Key,Law,Domain,Law_Summary,,,,,,,,,,,,,,,,,,,,,,
298,"(1) The Cabinet of Ministers shall provide for and determine all matters of policy relating to public officers, including policy relating to appointments, promotions, transfers, disciplinary control and dismissal.
(2) The appointment, promotion, transfer, disciplinary control and dismissal of all Heads of Department shall vest in the Cabinet of Ministers.
(3) Subject to the provisions of the Constitution, the appointment, promotion, transfer, disciplinary control and dismissal of public officers shall be vested in the Public Service Commission.
(4) The Commission shall not derogate from the powers and functions of the Provincial Public Service Commissions as are established by law.
(5) The Commission shall be responsible and answerable to Parliament in accordance with the provisions of the Standing Orders of Parliament for the exercise and discharge of its powers and functions. The Commission shall also forward to Parliament in each calendar year, a report of its activities in respect of such year.",Civil Law,"The Cabinet of Ministers holds authority over policy matters concerning public officers, encompassing appointments, promotions, transfers, disciplinary control, and dismissals. The appointment, promotion, transfer, disciplinary control, and dismissal of Heads of Department are within the jurisdiction of the Cabinet of Ministers. However, the Public Service Commission, subject to constitutional provisions, is responsible for the appointment, promotion, transfer, disciplinary control, and dismissal of public officers. The Commission is accountable to Parliament, following its standing orders, and must submit an annual report on its activities to Parliament. The powers and functions of Provincial Public Service Commissions established by law shall not be compromised by the Commission.",,,,,,,,,,,,,,,,,,,,,,
299,"(1) The Commission may delegate to a Committee consisting of three persons (not being members of the Commission) appointed by the Commission, the powers of appointment, promotion, transfer, disciplinary control and dismissal of such categories of public officers 41[as are specified by the Commission.
(2) The Commission shall cause the appointment of any such Committee to be published in the Gazette.
(3) The procedure and quorum for meetings of any such Committee shall be as determined by the Commission by rules made on that behalf. The Commission shall cause such rules to be published in the Gazette.
(4) There shall be a Secretary to each Committee, who shall be appointed by the Commission.",Civil Law,"The Public Service Commission (Commission) has the authority to delegate powers related to the appointment, promotion, transfer, disciplinary control, and dismissal of specified categories of public officers to a Committee of three individuals, not Commission members. The Commission's appointment of such a Committee must be published in the Gazette. The Commission establishes the procedure, quorum, and rules for Committee meetings, which are also published in the Gazette. Each Committee has a Secretary appointed by the Commission.",,,,,,,,,,,,,,,,,,,,,,
300,"(1) The Commission may delegate to a public officer, subject to such conditions and procedure as may be determined by the Commission, its powers of appointment, promotion, transfer, disciplinary control and dismissal of such category of public officers 42 as are specified by the Commission.
(2) The Commission shall cause any such delegation to be published in the Gazette, including the conditions and procedure determined by the Commission for such purpose",Civil Law,"The Commission is empowered to delegate its authority over the appointment, promotion, transfer, disciplinary control, and dismissal of specified categories of public officers to another public officer. This delegation is subject to conditions and procedures set by the Commission, and details of such delegation, including the specified conditions and procedures, are required to be published in the Gazette.",,,,,,,,,,,,,,,,,,,,,,
301,"(1) Any public officer aggrieved by an order relating to a promotion, transfer, dismissal or an order on a disciplinary matter made by a Committee or any public officer under Article 56 or Article 57, in respect of the officer so aggrieved, may appeal to the Commission against such order in accordance with such rules made by the Commission from time to time, relating to the procedure to be followed in the making, hearing and determination of an appeal made to the Commission and the period fixed within which an appeal should be heard and concluded.
(2) The Commission shall have the power upon such appeal to alter, vary, rescind or confirm an order against which an appeal is made, or to give directions in relation thereto, or to order such further or other inquiry as to the Commission shall seem fit.
(3) The Commission shall cause to be published in the Gazette the rules made by it under paragraph (1) of this Article.",Civil Law,"Any public officer dissatisfied with a decision made by a Committee or another public officer regarding promotion, transfer, or disciplinary matters under specified articles may appeal to the Commission. The Commission, following its rules for appeal procedures, can modify, annul, uphold, or issue directives on the contested order. Additionally, the Commission has the authority to order further inquiries as deemed appropriate. The rules established by the Commission for the appeal process must be published in the Gazette.",,,,,,,,,,,,,,,,,,,,,,
302,"(1) There shall be an Administrative Appeals Tribunal appointed by the Judicial Service Commission.
(2) The Administrative Appeals Tribunal shall have the power to alter, vary or rescind any order or decision made by the Commission.
(3) The constitution, powers and procedure of such a Tribunal, including the time limits for the preferring of appeals, shall be provided for by law.",Civil Law,"An Administrative Appeals Tribunal, appointed by the Judicial Service Commission, will have the authority to change or cancel any decision made by the Commission. The law will define the structure, authority, and procedures of this Tribunal, including deadlines for filing appeals.",,,,,,,,,,,,,,,,,,,,,,
303,"Upon delegation of any of its powers to a Committee or a public officer appointed under Article 56 or Article 57 as the case may be, the Commission shall not, while such delegation is in force, exercise or perform its functions or duties in regard to the categories of public officers in respect of which such delegation is made, subject to the provisions contained in paragraphs (1) and (2) of Article 58.",Civil Law,"When the Commission delegates its powers to a Committee or a public officer, it cannot perform those functions itself for the designated categories of public officers, unless specified otherwise in Article 58(1) and (2).",,,,,,,,,,,,,,,,,,,,,,
304,"(1) The quorum for a meeting of the Commission shall be five members.
(2) All decisions of the Commission shall be made by a majority of votes of the members present at the meeting. In the event of an equality of votes, the member presiding at the meeting shall have a casting vote.
(3) The Chairman of the Commission shall preside at all meetings of the Commission and in his absence, a member elected by the members present from amongst themselves, shall preside at such meeting.",Civil Law,"For a Commission meeting, at least five members must be present. Decisions are made by a majority vote, and in case of a tie, the presiding member casts the deciding vote. The Chairman leads meetings, and in their absence, a member chosen by others presides.",,,,,,,,,,,,,,,,,,,,,,
305,"Subject to the provisions of Article 59 and of Article 126, no court or tribunal shall have power or jurisdiction to inquire into, or pronounce upon or in any manner call in question any order or decision made by the Commission, a Committee, or any public officer, in pursuance of any power or duty conferred or imposed on such Commission, or delegated to a Committee or public officer, under this Chapter or under any other law.",Civil Law,"No court or tribunal can question decisions made by the Commission, its Committees, or public officers, as long as they act within their legal authority.",,,,,,,,,,,,,,,,,,,,,,
306,"Until the Commission otherwise provides, all rules, regulations and procedures relating to the public service as are in force on the date of the coming into operation of this Chapter, shall, mutatis mutandis, be deemed to continue in force as rules, regulations and procedures relating to the public service, as if they had been made or provided for under this Chapter.",Civil Law,"Until the Commission makes new rules, existing rules for the public service will remain in force. They'll be treated as if they were made under this Chapter.",,,,,,,,,,,,,,,,,,,,,,
307,"(1) Every person who, otherwise than in the course of such person’s lawful duty, directly or indirectly by himself or by or with any other person, in any manner whatsoever influences or attempts to influence or interferes with any decision of the Commission, or a Committee or a public officer to whom the Commission has delegated any power under this Chapter, or to so influence any member of the Commission or a Committee, shall be guilty of an offense and shall on conviction be liable to a fine not exceeding one hundred thousand Rupees or to imprisonment for a term not exceeding seven years, or to both such fine and imprisonment.
(2) Every High Court established under Article 154P of the Constitution shall have jurisdiction to hear and determine any matter referred to in paragraph (1).",Civil Law,Anyone who tries to influence or interfere with the decisions of the Commission or its officers unlawfully is committing an offense. They could face a fine or imprisonment. Cases related to this offense can be heard in the High Court established under Article 154P.,,,,,,,,,,,,,,,,,,,,,,
308,A person appointed to any office referred to in this Chapter shall not enter upon the duties of his office until he takes and subscribes the oath or makes and subscribes 44 the affirmations set out in the Fourth and Seventh Schedules to the Constitution.,Civil Law,"Before starting their duties, anyone appointed to certain offices must take an oath or affirm as outlined in the Constitution.",,,,,,,,,,,,,,,,,,,,,,
309,"The President shall appoint:
(a) the Heads of the Army, the Navy and the Air Force and
(b) 46 on the approval at the Constitutional Council, the Attorney-General and the Inspector-General of Police.",Civil Law,"The President appoints the leaders of the Army, Navy, and Air Force, and with approval from the Constitutional Council, appoints the Attorney-General and Inspector-General of Police.",,,,,,,,,,,,,,,,,,,,,,
310,"“public officer” does not include a member of the Army, Navy or Air Force, an officer of the Election Commission appointed by such Commission, a police officer appointed by the National Police Commission, a scheduled public officer appointed by the Judicial Service Commission or a member of the Sri Lanka State Audit Service appointed by the Audit Service Commission.",Civil Law,"""public officer"" doesn't include military personnel, certain election commission officers, police appointed by the national police commission, specific judicial service officers, or members of the Sri Lanka State Audit Service appointed by the Audit Service Commission.




",,,,,,,,,,,,,,,,,,,,,,
311,"48 (1) There shall be a Parliament which shall consist of two hundred and twenty-five Members elected in accordance with the provisions of the Constitution.
(2) Unless Parliament is dissolved, every Parliament shall continue for five years from the date appointed for its first meeting and no longer, and the expiry of the said period of five years shall operate as a dissolution of Parliament.",Civil Law,"This law states that there will be a Parliament with 225 elected Members. Each Parliament lasts for five years from its first meeting, and it dissolves automatically after this time unless dissolved earlier.",,,,,,,,,,,,,,,,,,,,,,
312,"(1) Parliament shall, at its first meeting after a General Election, elect three Members to be respectively the Speaker, the Deputy Speaker and Chairman of Committees (hereinafter referred to as the “Deputy Speaker”) and the Deputy Chairman of Committees thereof.
(2) A member holding office as the Speaker or the Deputy Speaker or the Deputy Chairman of Committees shall, unless he earlier resigns his office by a writing under his hand addressed to the President or ceases to be a Member, vacate his office on the dissolution of Parliament.
(3) Whenever the office of Speaker, Deputy Speaker or Deputy Chairman of Committees becomes vacant otherwise than as a result of a dissolution of Parliament, Parliament shall at its first meeting after the occurrence of the vacancy elect another Member to be the Speaker, the Deputy Speaker or the Deputy Chairman of Committees, as the case may be.
(4) If Parliament, after having been dissolved, is summoned under paragraph (7) of Article 70, each of the Members mentioned in paragraph (2) of this Civil Law Article shall, notwithstanding anything therein, resume and continue to hold his office while that Parliament is kept in session.
(5) The Speaker, or in his absence the Deputy Speaker, or in their absence the Deputy Chairman of Committees, shall preside at sittings of Parliament. If none of them is present, a Member elected by Parliament for the sitting shall preside at the sitting of Parliament.",Civil Law,"After a General Election, Parliament elects three members as Speaker, Deputy Speaker, and Deputy Chairman of Committees. They vacate office upon Parliament dissolution unless they resign or cease to be members. Vacancies are filled at the next Parliament meeting. If Parliament resumes after dissolution, previous officeholders continue. At sessions, the Speaker, Deputy Speaker, or Deputy Chairman presides, or a Member elected by Parliament if none are available.",,,,,,,,,,,,,,,,,,,,,,
313,"(1) There shall be a Secretary-General of Parliament who shall, on the approval of the Constitutional Council, be appointed by the President and who shall hold office during good behavior.
(2) The salary of the Secretary-General shall be determined by Parliament, shall be charged on the Consolidated Fund and shall not be diminished during his term of office.
(3) The members of the staff of the Secretary-General shall be appointed by him with the approval of the Speaker.
(4) The salaries of the members of the staff of the Secretary-General shall be charged on the Consolidated Fund.
(5) The office of the Secretary-General shall become vacant:
(a) upon his death
(b) on his resignation in writing addressed to the President
(c) on his attaining the age of sixty years, unless Parliament otherwise provides by law
(d) on his removal by the President on account of ill health or physical or mental infirmity or
(e) on his removal by the President upon an address of Parliament.",Civil Law,"A Secretary-General of Parliament, appointed by the President with Constitutional Council approval, holds office based on good behavior. Their salary, determined by Parliament, cannot be reduced during their tenure. The Secretary-General appoints staff with the Speaker's approval, and their salaries are covered by the Consolidated Fund. The Secretary-General's office becomes vacant upon death, resignation, reaching age 60, removal due to health issues, or upon Parliament's address to the President.",,,,,,,,,,,,,,,,,,,,,,
314,"Whenever the Secretary-General is unable to discharge the functions of his office, the President may Subject to the approval of the Constitutional Council, appoint a person to act in the place of the Secretary-General.",Civil Law,"If the Secretary-General can't perform their duties, the President, with the Constitutional Council's approval, can appoint someone to act in their place.",,,,,,,,,,,,,,,,,,,,,,
315,"The seat of a Member shall become vacant:
(a) upon his death
(b) If, by a writing under his hand addressed to the Secretary-General of Parliament, he resigns his seat
(c) upon his assuming the office of President consequent to his election to such office, either by the People or by Parliament
(d) if he becomes subject to any disqualification specified in Article 89 or 91
(e) if he becomes a member of the Public Service or an employee of a public corporation or, being a member of the Public Service or an employee of a public corporation, does not cease to be a member of such Service or an employee of such corporation, before he sits in Parliament
(f) if, without the leave of Parliament first obtained, he absents himself from the sittings of Parliament during a continuous period of three months
(g) if his election as a Member is declared void under the law in force for the time being
(h) upon the dissolution of Parliament or
(i) upon a resolution for his expulsion being passed in terms of Article 81.",Civil Law,"A Member's seat becomes vacant if they die, resign in writing, become President, face disqualification, join the public service, absent from Parliament without leave for three months, have their election declared void, Parliament is dissolved, or if expelled by a resolution.",,,,,,,,,,,,,,,,,,,,,,
316,"The privileges, immunities and powers of Parliament and of its Members may be determined and regulated by Parliament by law and until so determined and regulated, the provisions of the Parliament (Powers and Privileges) Act, shall, mutatis mutandis, apply.",Civil Law,"Parliament and its members can decide on their privileges, immunities, and powers through laws. Until then, they follow the rules outlined in the Parliament (Powers and Privileges) Act.",,,,,,,,,,,,,,,,,,,,,,
317,"(1) Ministers, Deputy Ministers and Members, including the Speaker, the Deputy Speaker and the Deputy Chairman of Committees, shall be paid such remuneration or allowance as may be provided by Parliament, by law or by resolution, and the receipt thereof shall not disqualify the recipient from sitting or voting in Parliament.
(2) Until Parliament so provides, the remuneration payable to Ministers, Deputy Ministers and Members, including the Speaker, the Deputy Speaker and the Deputy Chairman of Committees, shall be the same as the remuneration paid to Ministers, Deputy Ministers and Members including the Speaker, the Deputy Speaker and the Deputy Chairman of Committees of the National State Assembly immediately prior to the commencement of the Constitution.",Civil Law,"Members of Parliament, Ministers, Deputy Ministers, and certain officials like the Speaker can receive payment as determined by Parliament without losing their right to participate in parliamentary activities. Until Parliament sets specific payment rules, they'll receive the same pay as before the new rules came into effect.",,,,,,,,,,,,,,,,,,,,,,
318,Parliament shall have power to act notwithstanding any vacancy in its membership and its proceedings shall be valid notwithstanding that it is discovered subsequently that a person who was not entitled to do so sat or voted or otherwise took part in the proceedings.,Civil Law,"Parliament can function even if some seats are empty, and its decisions remain valid even if it's later found that someone participated in the proceedings who wasn't entitled to.",,,,,,,,,,,,,,,,,,,,,,
319,"(1) The President may, from time to time, by Proclamation summon, prorogue and dissolve Parliament.
Provided that:
(a) subject to the provisions of sub-paragraph (d), the President shall not dissolve Parliament until the expiration of a period of not less than two years and six months from the date appointed for its first meeting, unless Parliament by resolution requests the President to dissolve Parliament
(b) the President shall not dissolve Parliament on the rejection of the Statement of Government Policy at the commencement of the first session of Parliament after a General Election
(c) subject to the provisions of sub-paragraph (d), the President shall not dissolve Parliament after the Speaker has entertained a resolution complying with the requirements of sub-paragraphs (a) and (b) of paragraph (2) of Article 38, unless:
(i) such resolution is not passed as required by sub-paragraph (c) of paragraph (2) of Article 38
(ii) the Supreme Court determines and reports that the President has not become permanently incapable of discharging the functions of his office or that the President has not been guilty of any of the other allegations contained in such resolution
(iii) the consequent resolution for the removal of the President is not passed as required by sub-paragraph (e) of paragraph (2) of Article 38 or
(iv) Parliament by resolution requests the President to dissolve Parliament
(d) where the President has not dissolved Parliament consequent upon the rejection by Parliament of the Appropriation Bill, the President shall dissolve Parliament if Parliament rejects the next Appropriation Bill.
(2) Parliament shall be summoned to meet once at least in every year.
(3) A Proclamation proroguing Parliament shall fix a date for the next session, not being more than two months after the date of the Proclamation.
Provided that at any time while Parliament stands prorogued the President may by Proclamation:
(i) summon Parliament for an earlier date, not being less than three days from the date of such Proclamation or
(ii) subject to the provisions of this Article, dissolve Parliament.
(4) All matters which, having been duly brought before Parliament, have not been disposed of at the time of the prorogation of Parliament, may be proceeded with during the next session.
(5) (a) A Proclamation dissolving Parliament shall fix a date or dates for the election of Members of Parliament, and shall summon the new Parliament to meet on a date not later than three months after the date of such Proclamation.
(b) Upon the dissolution of Parliament by virtue of the provisions of paragraph (2) of Article 62, the President shall forthwith by Proclamation fix a date or dates for the election of Members of Parliament, and shall summon the new Parliament to meet on a date not later than three months after the date of such Proclamation.
(c) The date fixed for the first meeting of Parliament by a Proclamation under subparagraph (a) or sub-paragraph (b) may be varied by a subsequent Proclamation, provided that the date so fixed by the subsequent Proclamation shall be a date not later than three months after the date of the original Proclamation.
(6) Where the poll for the election of the President is to be taken on a date which falls between the date of dissolution of Parliament and the date before which Parliament is required by paragraph (5) of this Article to be summoned to meet, Parliament shall, notwithstanding anything in that paragraph, be summoned to meet on a date not later than four months after the date of dissolution of Parliament.
(7) If at any time after the dissolution of Parliament, the President is satisfied that an emergency has arisen of such a nature that an earlier meeting of Parliament is necessary, he may by Proclamation summon the Parliament which has been dissolved to meet on a date not less than three days from the date of such Proclamation and such Parliament shall stand dissolved upon the termination of the emergency or the conclusion of the General Election, whichever is earlier.",Civil Law,"The President has the power to call, suspend, and end sessions of Parliament by making official announcements called proclamations. Certain conditions must be met, such as waiting at least two and a half years before dissolving Parliament, unless Parliament requests it. Parliament must meet at least once a year. When Parliament is suspended, any unfinished business can be continued in the next session. When Parliament is dissolved, elections for new Members of Parliament must be held within three months. If necessary, Parliament can be called to meet earlier during emergencies.",,,,,,,,,,,,,,,,,,,,,,
320,"Parliament may adjourn from time to time as it may determine by resolution or Standing Order, until it is prorogued or dissolved.",Civil Law,"Parliament can decide when to take breaks, called adjournments, either through a resolution or a rule called a Standing Order. This continues until Parliament is formally ended through prorogation or dissolution.",,,,,,,,,,,,,,,,,,,,,,
321,"(1) Save as otherwise provided in the Constitution any question proposed for decision by Parliament shall be decided by the majority of votes of the Members present and voting.
(2) The person presiding shall not vote in the first instance but shall have and exercise a casting vote in the event of an equality of votes.",Civil Law,"Any decision in Parliament is typically made by a majority vote of the Members present and voting, unless stated otherwise in the Constitution. The presiding person doesn't initially vote but can break ties with a casting vote if the votes are equal.",,,,,,,,,,,,,,,,,,,,,,
322,"If at any time during a meeting of Parliament the attention of the person presiding is drawn to the fact that there are fewer than twenty Members present, the person presiding shall, subject to any Standing Order, adjourn the sitting without question.",Civil Law,"If fewer than twenty Members are present during a Parliament meeting, the presiding person must adjourn the sitting immediately, as per the rules.",,,,,,,,,,,,,,,,,,,,,,
